id,name,description,createdBy,projectLogs,projectState,taskStates,projectStates
c5600614-1b56-4160-b699-ecffaa8dfb6a,Israa,hddjdjd,Mohamed,User Mohamed create PROJECT Israa  at 2025/05/03 7:21 AM,todo,todo|inprogress|done,todo|test,
ad4b08e8-4d35-4ab1-b582-96e3fd3be551,hhdfjf,hghgjgjg,Mohamed,User Mohamed CREATE PROJECT hhdfjf  at 2025/05/03 7:27 AM,gkgkg,hfhf|hgjg|gogg,hhg|gkgkg|glggl,
1726325a-6ddd-428e-99fe-50709ed7e940,ABC,hfhfhfhhfhfhfhfhhfhf fjhfjjjfjfj,Mohamed,User Mohamed create project hghgk  at 2025/05/03 7:29 AM|User Mohamed update project hghgk name from hghgk to ABC at 2025/05/03 10:07 AM|User Mohamed update project hghgk description from fkgkgkkg to project updated to ABC at 2025/05/03 10:07 AM|User Mohamed update project ABC description from project updated to ABC to hfhfhfhhfhfhfhfhhfhf fjhfjjjfjfj at 2025/05/03 10:19 AM,jjf,jjfjf,jjf|fkkf|kfkf,
64d82716-d132-4fd5-83d0-34a98b0af021,hfjjfjf,jfjjfjfj,Mohamed,User Mohamed create project hfjjfjf  at 2025/05/03 10:22 AM,fkfkf,jfjjf|fkfkf|kfkkf,jfjjf|fkfkf|fkfkf,
4251ec33-9722-4783-964f-422f65cd8256,hfhfh,fjjfjfjf,Mohamed,User Mohamed create project hfhfh  at 2025/05/03 11:21 AM,fkkf,jfjf|jfjf|ififf,hfhf|fkkf|fiff,
64d82716-d132-4fd5-83d0-34a98b0af021,New Name,new desc,Mohamed,User Mohamed create project hfjjfjf  at 2025/05/03 10:22 AM|User Mohamed update project hfjjfjf name from hfjjfjf to New Name at 2025/05/03 10:42 AM|User Mohamed update project hfjjfjf description from jfjjfjfj to new desc at 2025/05/03 10:42 AM,fkfkf,jfjjf|fkfkf|kfkkf,jfjjf|fkfkf|fkfkf,
363f0444-91e9-453e-9376-f68770d517cd,AAAAAA,AAAAAAAAA,Mohamed,User Mohamed create project AAAAAA  at 2025/05/03 11:13 AM,AAA,AAAA|AAAAAAa|a,AAA|AAAA|AAAAAA,
26fb5810-951e-4913-aae8-1d36d72d85eb,GOGO,fkkkf,Mohamed,User Mohamed create project jfjjf  at 2025/05/03 11:55 AM|User Mohamed update project jfjjf name from jfjjf to GOGO at 2025/05/03 12:29 PM,kfkkf,fkkfkf,fkkfkf|kfkkf|fkff,
